{
  "schema": "squadpad.athlete-bindings.v1",
  "playback_id": "rondo-4v1.level-1.segment-0.pass-receive",
  "playback_sha256": "1767d85fa928d49f40a2893244b2c95ade27a56b88a03c03764138ed98dfe337",
  "profiles": [
    {
      "id": "baseline.athlete_a",
      "skeleton_id": "baseline_rig.athlete_a",
      "mesh_asset_id": "SK_AthleteA",
      "mesh_source_sha256": "d3a1d34d2bef02d7ea03344fafa4376a0075f5e926ac2c40a640a592bc42e4c6",
      "animations": [
        {
          "source_motion_id": "canonical.idle",
          "animation_asset_id": "A_Idle",
          "skeleton_id": "baseline_rig.athlete_a",
          "target_mesh_sha256": "d3a1d34d2bef02d7ea03344fafa4376a0075f5e926ac2c40a640a592bc42e4c6",
          "animation_source_sha256": "980ad838edbaca7c819092ab75ac37953bca917b74a870320127f49c076e9f69",
          "duration_seconds": 4.1
        },
        {
          "source_motion_id": "canonical.pass",
          "animation_asset_id": "A_Pass",
          "skeleton_id": "baseline_rig.athlete_a",
          "target_mesh_sha256": "d3a1d34d2bef02d7ea03344fafa4376a0075f5e926ac2c40a640a592bc42e4c6",
          "animation_source_sha256": "8a3ace2e649b9f8a5a36f95d33ee713b990578998550ed27834cbdb8d2670d52",
          "duration_seconds": 3.3925
        },
        {
          "source_motion_id": "canonical.receive",
          "animation_asset_id": "A_Receive",
          "skeleton_id": "baseline_rig.athlete_a",
          "target_mesh_sha256": "d3a1d34d2bef02d7ea03344fafa4376a0075f5e926ac2c40a640a592bc42e4c6",
          "animation_source_sha256": "3486ee5ce74b155aaabba0ca63801288cbbc048ffb82c4e59eb1af4bea86db6c",
          "duration_seconds": 1.3
        }
      ],
      "calibration": {
        "status": "unmeasured",
        "mesh_source_sha256": "d3a1d34d2bef02d7ea03344fafa4376a0075f5e926ac2c40a640a592bc42e4c6"
      }
    }
  ],
  "slots": [
    {
      "appearance_slot": "actor.A.appearance",
      "profile_id": "baseline.athlete_a"
    },
    {
      "appearance_slot": "actor.B.appearance",
      "profile_id": "baseline.athlete_a"
    }
  ]
}
